"Name","Address","Phone","Category","Website","Rating","Reviews","Price Range","Hours","Description","Merchant Verified","Business Closed","Dine-In","Takeout","Delivery","Review 1 Text","Review 1 Score","Review 2 Text","Review 2 Score","Review 3 Text","Review 3 Score","Image URL","Listing CID","Lat","Long","Listing URL","Email","Facebook","Twitter","Instagram","LinkedIn"
"Jumping monkey Dispensary","189 9 ถนน มูลเมือง 7 ตำบลศรีภูมิ อำเภอเมืองเชียงใหม่ เชียงใหม่ 50200","0805563969","ร้านขายกัญชาในเทศบาลนครเชียงใหม่","","5.0","69",""," วันพฤหัสบดี 11:00–23:00, วันศุกร์ 11:00–23:00, วันเสาร์ 11:00–23:00, วันอาทิตย์ 11:00–23:00, วันจันทร์ 11:00–23:00, วันอังคาร ปิดทำการ, วันพุธ<div>(วันปิยมหาราช)</div> 11:00–23:00<div><span>เวลาทำการอาจแตกต่างกันไป</span></div>,","","Yes","No","No","No","No","ดีมากครับร้านนี้ กลับไปซ้ำ","ได้รับ 5.0 จาก 5 ดาว,","บอกเลยเรื่องสมุนไพรไว้ใจได้เลย!!!","ได้รับ 5.0 จาก 5 ดาว,","","","https://lh5.googleusercontent.com/p/AF1QipPQHoVithsFlqzgkuQNl3eoi_n45aWHChuryNFD","12448765537977209531","18.7923062","98.9931979","http://maps.google.com/maps/place?cid=12448765537977209531","","","","",""
"Top Genetics Weed Shop and Cannabis Dispensary","22/1 ถนน ศิริมังคลาจารย์ ซอย 3 ตำบลสุเทพ อำเภอเมืองเชียงใหม่ เชียงใหม่ 50200","0930303313","ร้านขายกัญชาในเทศบาลนครเชียงใหม่","https://www.topgenetics.org/","5.0","240",""," วันพฤหัสบดี 12:00–0:00, วันศุกร์ 12:00–0:00, วันเสาร์ 12:00–0:00, วันอาทิตย์ 12:00–0:00, วันจันทร์ 12:00–0:00, วันอังคาร 12:00–0:00, วันพุธ<div>(วันปิยมหาราช)</div> 12:00–0:00<div><span>เวลาทำการอาจแตกต่างกันไป</span></div>,","","Yes","No","No","No","No","บรรยากาศชิวมากๆๆเลย คนขายแนะสินค้าได้ดีมาก","ได้รับ 5.0 จาก 5 ดาว,","ร้านดีจัดอะครับฟิวร้านอย่างชอบเลยครับดีจริง","ได้รับ 5.0 จาก 5 ดาว,","บัดเทนเดอร์แนะนำดีมากครับ บรรยากาศดี มีของดีให้เลือกเยอะ","ได้รับ 5.0 จาก 5 ดาว,","https://lh5.googleusercontent.com/p/","11114402833177394733","18.795707999999998","98.9735031","http://maps.google.com/maps/place?cid=11114402833177394733","","","","",""
"Weed Shop LungYim CNX2 Cannabis shop - weed,cannabis","33 7 ถ. มูลเมือง ตำบล พระสิงห์ อำเภอเมืองเชียงใหม่ เชียงใหม่ 50200","0947079025","ร้านขายกัญชาในเทศบาลนครเชียงใหม่","https://www.facebook.com/LungYimCNX2/","5.0","28",""," วันพฤหัสบดี 12:00–1:00, วันศุกร์ 12:00–1:00, วันเสาร์ 12:00–1:00, วันอาทิตย์ 12:00–1:00, วันจันทร์ 12:00–1:00, วันอังคาร 12:00–1:00, วันพุธ<div>(วันปิยมหาราช)</div> 12:00–1:00<div><span>เวลาทำการอาจแตกต่างกันไป</span></div>,","","Yes","No","No","No","No","ร้านดีมาก คนขาอารมณ์ดี ให้คำปรึกษา และบริการดี ไม่ผิดหวัง ชอบครับ","ได้รับ 5.0 จาก 5 ดาว,","ร้านบริการดี เป็นกันเองมาก ของคุณภาพดีมากครับ","ได้รับ 5.0 จาก 5 ดาว,","","","https://lh5.googleusercontent.com/p/AF1QipMC1qDiLW65rpjRtg6soyb-GkfVDldY__RL9eVi","4756297588158910440","18.7864714","98.993","http://maps.google.com/maps/place?cid=4756297588158910440","","https://www.facebook.com/LungYimCNX2","","",""
"Ruttigan Weed CNX","2 1 ถ. โชตนา ตำบลช้างเผือก อำเภอเมืองเชียงใหม่ เชียงใหม่ 50300","0946205250","ร้านขายกัญชาในเทศบาลนครเชียงใหม่","https://lin.ee/VAKZ3cp","5.0","4",""," วันพฤหัสบดี 17:00–23:00, วันศุกร์ 17:00–23:00, วันเสาร์ 17:00–23:00, วันอาทิตย์ 17:00–23:00, วันจันทร์ 17:00–23:00, วันอังคาร 17:00–23:00, วันพุธ<div>(วันปิยมหาราช)</div> 17:00–23:00<div><span>เวลาทำการอาจแตกต่างกันไป</span></div>,","","Yes","No","No","No","No","","","","","","","https://lh5.googleusercontent.com/p/","2162785641215481903","18.8124373","98.9840694","http://maps.google.com/maps/place?cid=2162785641215481903","","","","",""
"Leafers Cannabis Dispensary Chiangmai","4, 2 ถนน ชัยภูมิ ตำบล ช้างม่อย Mueang, เชียงใหม่ 50300","0930487000","ร้านขายกัญชาในเทศบาลนครเชียงใหม่","https://www.leaferscannabis.com/","4.9","163",""," วันพฤหัสบดี 10:00–2:00, วันศุกร์ 10:00–2:00, วันเสาร์ ปิดทำการ, วันอาทิตย์ 10:00–2:00, วันจันทร์ 10:00–0:00, วันอังคาร 10:00–2:00, วันพุธ<div>(วันปิยมหาราช)</div> 10:00–2:00<div><span>เวลาทำการอาจแตกต่างกันไป</span></div>,","","Yes","No","No","No","No","ดอกไม้คุณภาพดี สมราคา มีเล้าจ์ ให้นั่งสูบ ชมวิวท่าแพ","ได้รับ 5.0 จาก 5 ดาว,","ดอกแน่น กลิ่นหอม ติดปากติดคอ คุ้มราคา","ได้รับ 5.0 จาก 5 ดาว,","ร้านน่ารัก บริการดีครับ","ได้รับ 5.0 จาก 5 ดาว,","https://lh5.googleusercontent.com/p/AF1QipOUosNyyF1HEFydeONddndE_B8R-Ny-skaX9XAo","9744726509169394628","18.7882557","98.9936256","http://maps.google.com/maps/place?cid=9744726509169394628","","","","",""
"The Joint Cannabis Dispensary","85 ถนน บำรุงบุรี ตำบล พระสิงห์ อำเภอเมืองเชียงใหม่ เชียงใหม่ 50200","0836597896","ร้านขายกัญชาในเทศบาลนครเชียงใหม่","http://thejointthailand.com/","5.0","734",""," วันพฤหัสบดี 11:00–23:00, วันศุกร์ 11:00–1:00, วันเสาร์ 11:00–1:00, วันอาทิตย์ 11:00–23:00, วันจันทร์ 11:00–23:00, วันอังคาร 11:00–23:00, วันพุธ<div>(วันปิยมหาราช)</div> 11:00–23:00<div><span>เวลาทำการอาจแตกต่างกันไป</span></div>,","","Yes","No","No","No","No","ร้านน่ารักมากครับ พี่พนง.พูดดี ให้คำแนะนำดีมาก A very lovely place.","ได้รับ 5.0 จาก 5 ดาว,","ร้านสวย พนักงานเฟรนด์ลี่ มีดอกไม้คุณภาพหลากหลายให้เลือก จะบอกต่อให้นะคะ","ได้รับ 5.0 จาก 5 ดาว,","ของสุดมากครับ แนะนำมาได้เลยคับ เจ้าของน้านน่ารักมากและใจดีมากคับ","ได้รับ 5.0 จาก 5 ดาว,","https://lh5.googleusercontent.com/p/","14501863873841167432","","","http://maps.google.com/maps/place?cid=14501863873841167432","","","","https://www.instagram.com/thejointchiangmai/",""
"Hippysor Cnx Cannabis","386 หมู่บ้านเชียงใหม่เเลนด์ ตำบลช้างคลาน เมือง เชียงใหม่ 50100","0921813911","ร้านขายกัญชาในเทศบาลนครเชียงใหม่","https://www.facebook.com/profile.php?id=100090272426018&mibextid=LQQJ4d","5.0","7",""," วันพฤหัสบดี 10:00–22:00, วันศุกร์ 10:00–22:00, วันเสาร์ 10:00–22:00, วันอาทิตย์ 10:00–22:00, วันจันทร์ ปิดทำการ, วันอังคาร 10:00–22:00, วันพุธ<div>(วันปิยมหาราช)</div> 10:00–22:00<div><span>เวลาทำการอาจแตกต่างกันไป</span></div>,","","Yes","No","No","No","No","","","","","","","https://lh5.googleusercontent.com/p/AF1QipMdkVEz7i_xNz-CpwwmDd4-FJzQDKTzleOuWIoS","6468481789256406757","18.767092599999998","98.9959927","http://maps.google.com/maps/place?cid=6468481789256406757","","https://www.facebook.com/people/Hippysor-Cnx/100090272426018/","","",""
"กัญชา 420","122/54 เมือง เชียงใหม่ 50300","0636697896","","","","",""," วันพฤหัสบดี 8:00–0:00, วันศุกร์ 8:00–0:00, วันเสาร์ 8:00–0:00, วันอาทิตย์ 8:00–0:00, วันจันทร์ 8:00–23:00, วันอังคาร 8:00–23:00, วันพุธ<div>(วันปิยมหาราช)</div> 8:00–0:00<div><span>เวลาทำการอาจแตกต่างกันไป</span></div>,","","Yes","No","No","No","No","","","","","","","https://lh5.googleusercontent.com/p/","3338677929910165722","18.814650399999998","98.95066709999999","http://maps.google.com/maps/place?cid=3338677929910165722","","","","",""
"ใจแลกใจ - Jai Laek Jai Cannabis shop","40 2 ตำบลช้างคลาน เมือง เชียงใหม่ 50100","0803269980","ร้านขายกัญชาในเทศบาลนครเชียงใหม่","","5.0","7",""," วันพฤหัสบดี 10:00–0:00, วันศุกร์ 10:00–0:00, วันเสาร์ 10:00–0:00, วันอาทิตย์ 10:00–0:00, วันจันทร์ 10:00–0:00, วันอังคาร 10:00–0:00, วันพุธ<div>(วันปิยมหาราช)</div> 10:00–0:00<div><span>เวลาทำการอาจแตกต่างกันไป</span></div>,","","Yes","No","No","No","No","สินค้าคุณภาพมากครับ น้องพนักงานบริการสุภาพน่ารัก","ได้รับ 5.0 จาก 5 ดาว,","คุณภาพดี ราคาถูก ครับ","ได้รับ 5.0 จาก 5 ดาว,","","","https://lh5.googleusercontent.com/p/AF1QipNxTCl59Am8Ty2AjMPLE4Hrn6ljCvmuMwIKMVqv","838872956139918361","18.7809891","98.99532269999999","http://maps.google.com/maps/place?cid=838872956139918361","","","","",""
"ยอดมนุษย์กัญชาคาเฟ่ สาขาผึ้งน้อย คาเฟ่ เชียงใหม่","RX6Q+H77 ตำบลช้างเผือก อำเภอเมืองเชียงใหม่ เชียงใหม่ 50300","0987499101","ร้านอาหาร","","4.6","35",""," วันพฤหัสบดี 7:00–20:00, วันศุกร์ 7:00–20:00, วันเสาร์ 7:00–20:00, วันอาทิตย์ 7:00–20:00, วันจันทร์ 7:00–20:00, วันอังคาร 7:00–20:00, วันพุธ<div>(วันปิยมหาราช)</div> 7:00–20:00<div><span>เวลาทำการอาจแตกต่างกันไป</span></div>,","","Yes","No","No","No","No","อร่อย ราคามิตรภาพ พนักงานพูดจาไพเราะ มีมารทงาม","ได้รับ 4.0 จาก 5 ดาว,","จ่าย AIR PAY ง่าย สะดวกสบาย ไม่ต้องพกเงินสดเลยครับ","ได้รับ 5.0 จาก 5 ดาว,","ร้านอาหารสวัสดิการพนักงาน","ได้รับ 4.0 จาก 5 ดาว,","https://lh5.googleusercontent.com/p/","6355986472261571687","18.811424799999998","98.9881791","http://maps.google.com/maps/place?cid=6355986472261571687","","","","",""
"The Spot Cannabis Dispensary - ร้านกัญชาเชียงใหม่ Cannabis shop Chiang Mai","36 ถนน นิมมานเหมินท์ ซอย 11 ตำบลสุเทพ อำเภอเมืองเชียงใหม่ เชียงใหม่ 50200","0616145508","ร้านขายกัญชา","http://thespotcnx.com/","5.0","149",""," วันพฤหัสบดี 10:00–20:00, วันศุกร์ 10:00–23:00, วันเสาร์ 10:00–23:00, วันอาทิตย์ 10:00–23:00, วันจันทร์ 10:00–23:00, วันอังคาร 10:00–23:00, วันพุธ<div>(วันปิยมหาราช)</div> 10:00–23:00<div><span>เวลาทำการอาจแตกต่างกันไป</span></div>,","","Yes","No","No","No","No","ให้คำแนะนำดีมาก มีสินค้าเยอะ มีที่ให้นั่งเล่นชิลๆหลายมุมมาก แนะนำเลยค่ะ","ได้รับ 5.0 จาก 5 ดาว,","บรรยากาศร้านดีเว่อ เพลงเพราะ พนักงานใจดีมากกกก รักเลย","ได้รับ 5.0 จาก 5 ดาว,","บรรยากาศน่ารักมากค่ะ เจ้าของร้านใจดี แนะนำดีมากค่ะ","ได้รับ 5.0 จาก 5 ดาว,","https://lh5.googleusercontent.com/p/AF1QipP4uMr-Lm6OF40yMOfNgIx0-zE2Lg8MtHGAMVy9","13894851770357860717","18.7967285","98.9692778","http://maps.google.com/maps/place?cid=13894851770357860717","","","","",""
"Cannabee Flagship Store","26 1 ถนนสันติสุข ซ. 5 ตำบลสุเทพ อำเภอเมืองเชียงใหม่ เชียงใหม่ 50200","0956989901","ร้านขายกัญชาในเทศบาลนครเชียงใหม่","http://www.cannabeethai.com/?utm_source=google&utm_medium=wix_google_business_profile&utm_campaign=8329653961996125574","5.0","20",""," วันพฤหัสบดี 11:00–0:00, วันศุกร์ 11:00–0:00, วันเสาร์ 11:00–0:00, วันอาทิตย์ 11:00–0:00, วันจันทร์ 11:00–0:00, วันอังคาร 11:00–0:00, วันพุธ<div>(วันปิยมหาราช)</div> 11:00–0:00<div><span>เวลาทำการอาจแตกต่างกันไป</span></div>,","","Yes","No","No","No","No","ร้านสวยมากๆ พนักงานบริการดี มีดอกไม้คุณภาพดีและหลากหลายสายพันธุ์","ได้รับ 5.0 จาก 5 ดาว,","พนักงานที่ร้านบริการและแนะนำดีมาก มี Accessories เยอะ ดอกสวยๆเยอะมากค่ะ","ได้รับ 5.0 จาก 5 ดาว,","","","https://lh5.googleusercontent.com/p/","17355453552170736304","18.798304599999998","98.97015429999999","http://maps.google.com/maps/place?cid=17355453552170736304","","","","",""
"Buddy Ben Cannabis @Chiang Mai Gate","30, 32 ถนน พระปกเกล้า ซอย 1 ตำบล พระสิงห์ เมือง เชียงใหม่ 50200","0821683645","ร้านขายกัญชาในเทศบาลนครเชียงใหม่","","5.0","43",""," วันพฤหัสบดี ปิดทำการ, วันศุกร์ 17:00–23:00, วันเสาร์ 12:00–23:00, วันอาทิตย์ 17:00–23:00, วันจันทร์ 17:00–23:00, วันอังคาร 17:00–23:00, วันพุธ<div>(วันปิยมหาราช)</div> 17:00–23:00<div><span>เวลาทำการอาจแตกต่างกันไป</span></div>,","","Yes","No","No","No","No","","","","","","","https://lh5.googleusercontent.com/p/AF1QipMp47AgVXAJYbVsxKAXbamKmqiJp7hjztoVCRmd","18033239266718072542","18.7819903","98.9890272","http://maps.google.com/maps/place?cid=18033239266718072542","","","","",""
"BC Green Grower Cafe สาขานิมมาน","Nimman ถนน นิมมาน, 43 ถนนนิมมานเหมินท์ ตำบลสุเทพ เมือง, เชียงใหม่ 50200","0992964159","ร้านขายกัญชาในเทศบาลนครเชียงใหม่","","4.9","48",""," วันพฤหัสบดี 9:00–2:00, วันศุกร์ 9:00–2:00, วันเสาร์ 9:00–2:00, วันอาทิตย์ 12:00–0:00, วันจันทร์ 9:00–2:00, วันอังคาร 9:00–2:00, วันพุธ<div>(วันปิยมหาราช)</div> 9:00–2:00<div><span>เวลาทำการอาจแตกต่างกันไป</span></div>,","","Yes","No","No","No","No","บรรยากาศดีมาก พนักงานบริการใจดี!","ได้รับ 5.0 จาก 5 ดาว,","บรรยากาศที่ใช่อะไรก็ชอบ","ได้รับ 5.0 จาก 5 ดาว,","","","https://lh5.googleusercontent.com/p/","6815735162910828202","18.797524499999998","98.9666414","http://maps.google.com/maps/place?cid=6815735162910828202","","","","",""
"GoGreen by Kanya - Nimman Soi 13","12/21 Room B, Subdistrict, 11 Soi 13, ตำบลสุเทพ อำเภอเมืองเชียงใหม่ เชียงใหม่ 50200","","ร้านขายกัญชาในเทศบาลนครเชียงใหม่","http://www.gogreenbykanya.com/","4.9","95",""," วันพฤหัสบดี 11:00–22:00, วันศุกร์ 11:00–22:00, วันเสาร์ 11:00–22:00, วันอาทิตย์ 11:00–22:00, วันจันทร์ 11:00–22:00, วันอังคาร 11:00–22:00, วันพุธ<div>(วันปิยมหาราช)</div> 11:00–22:00<div><span>เวลาทำการในวันหยุด</span></div>,","","Yes","No","No","No","No","บรรยากาศภายในร้านดี สะอาด มีของให้เลือกเยอะพนักงานบริการดีเป็นกันเอง","ได้รับ 5.0 จาก 5 ดาว,","ร้านสะอาดมาก คนขายน่ารัก edible กินแล้วโอเคเลย ติดใจกลับมาซื้ออีกค่ะ","ได้รับ 5.0 จาก 5 ดาว,","แม่ค้าน่ารัก เป็นกันเอง เเนะนำดี ไว้จะไปอุดหนุดอีกครับ 🍀☘️","ได้รับ 5.0 จาก 5 ดาว,","https://lh5.googleusercontent.com/p/AF1QipMjwrqIfHONXyckqTjvbRY8VSpJPpKewxus8OgW","3556614382107263762","18.795875300000002","98.96848229999999","http://maps.google.com/maps/place?cid=3556614382107263762","","","","",""
"PK Cannabis Chiang Mai (Huaykaew) พีเค แคนนาบิส เชียงใหม่ (ห้วยแก้ว)","95 ถ. ห้วยแก้ว ตำบลสุเทพ อำเภอเมืองเชียงใหม่ เชียงใหม่ 50200","0951746664","ร้านขายกัญชาในเทศบาลนครเชียงใหม่","","4.8","25",""," วันพฤหัสบดี 9:00–21:00, วันศุกร์ 9:00–21:00, วันเสาร์ 11:00–21:00, วันอาทิตย์ 11:00–21:00, วันจันทร์ 9:00–21:00, วันอังคาร 9:00–21:00, วันพุธ<div>(วันปิยมหาราช)</div> 9:00–21:00<div><span>เวลาทำการอาจแตกต่างกันไป</span></div>,","","Yes","No","No","No","No","","","","","","","https://lh5.googleusercontent.com/p/","1879096675301106626","18.7991278","98.9715303","http://maps.google.com/maps/place?cid=1879096675301106626","","","","",""
"Shaman Farm","172/1 ถ. ราชมรรคา ตำบลศรีภูมิ Amphoe Meang, เชียงใหม่ 50200","0956979932","ร้านขายกัญชาในเทศบาลนครเชียงใหม่","","4.8","25",""," วันพฤหัสบดี 14:00–20:00, วันศุกร์ 14:00–20:00, วันเสาร์ 14:00–20:00, วันอาทิตย์ ปิดทำการ, วันจันทร์ 14:00–20:00, วันอังคาร 14:00–20:00, วันพุธ<div>(วันปิยมหาราช)</div> ปิดทำการ,","","Yes","No","No","No","No","ร้านบรรยากาศดี เจ้าของร้านน่ารักเป็นกันเองมากครับ แนะนำเลยครับ","ได้รับ 5.0 จาก 5 ดาว,","ร้านน่ารัก พี่เจ้าของก็น่ารักมากค่า 😁","ได้รับ 5.0 จาก 5 ดาว,","","","https://lh5.googleusercontent.com/p/AF1QipOnLWcESGdDHHLsmf4ObL8slNmviEzbDbAaCP-z","15242429782798095107","18.7858549","98.9796868","http://maps.google.com/maps/place?cid=15242429782798095107","","","","",""
"Flying Tiger Cannabis Dispensary","29 Khotchasam Road, ตำบลช้างคลาน อำเภอเมืองเชียงใหม่ เชียงใหม่ 50100","0954094482","ร้านขายกัญชาในเทศบาลนครเชียงใหม่","","5.0","545",""," วันพฤหัสบดี 11:00–23:00, วันศุกร์ 11:00–23:00, วันเสาร์ 11:00–23:00, วันอาทิตย์ 11:00–23:00, วันจันทร์ 11:00–23:00, วันอังคาร 11:00–23:00, วันพุธ<div>(วันปิยมหาราช)</div> 11:00–23:00<div><span>เวลาทำการอาจแตกต่างกันไป</span></div>,","","Yes","No","No","No","No","ร้านน่ารักมาก พี่พนักงานชื่อใหม่ ใจดีมากค่ะ จะแวะมาใช้บริการอีกนะคะ","ได้รับ 5.0 จาก 5 ดาว,","📍แนะนำสายเขียวครับ มาเชียงใหม่ต้องมาโดนครับ ของดีเชียงใหม่ เจ้าของร้านใจดี","ได้รับ 5.0 จาก 5 ดาว,","ร้านอากาศเย็นสบาย เนื้อคุณภาพสูง","ได้รับ 5.0 จาก 5 ดาว,","https://lh5.googleusercontent.com/p/","16042610884486450056","18.7869919","98.9936575","http://maps.google.com/maps/place?cid=16042610884486450056","","","","",""
