"Name","Address","Phone","Category","Website","Rating","Reviews","Price Range","Hours","Description","Merchant Verified","Business Closed","Dine-In","Takeout","Delivery","Review 1 Text","Review 1 Score","Review 2 Text","Review 2 Score","Review 3 Text","Review 3 Score","Image URL","Listing CID","Lat","Long","Listing URL","Email","Facebook","Twitter","Instagram","LinkedIn"
"มินฟาร์ม","260 ป่าสัก อำเภอ เชียงแสน เชียงราย 57150","0647353873","ร้านขายกัญชาในตำบล ศรีดอนมูล","https://web.facebook.com/profile.php?id=100080002561343","5.0","16",""," วันพุธ 9:00–17:00, วันพฤหัสบดี 9:00–17:00, วันศุกร์ 9:00–17:00, วันเสาร์ 9:00–17:00, วันอาทิตย์<div>(วันคล้ายวันสวรรคตพระบาทสมเด็จพระบรมชนกาธิเบศร มหาภูมิพลอดุลยเดชมหาราช บรมนาถบพิตร)</div> ปิดทำการ, วันจันทร์<div>(วันคล้ายวันสวรรคตพระบาทสมเด็จพระบรมชนกาธิเบศร มหาภูมิพลอดุลยเดชมหาราช บรมนาถบพิตร (วันหยุดชดเชย))</div> 9:00–17:00<div><span>เวลาทำการอาจแตกต่างกันไป</span></div>, วันอังคาร 9:00–17:00,","","Yes","No","No","No","No","เป็นสถานที่ที่สวยมากค่ะ บรรยากาศดีมากๆ นั่งชมวิวชิวๆ ชอบมากค่ะ","ได้รับ 5.0 จาก 5 ดาว,","วิวสวยบรรยายดี บริการดีสุภาพเทคแคร์ลูกค้าดีมาก ที่สำคัญคุณภาพดีมาก","ได้รับ 5.0 จาก 5 ดาว,","หอมละมุนละไม บริการดีน่ารัก ชอบมาก","ได้รับ 5.0 จาก 5 ดาว,","https://lh5.googleusercontent.com/p/AF1QipONNAHiR9iOuAPojc9dJeWIgqeJtp0V_hbxcIBd","15889947727348850995","20.3330678","100.05105189999999","http://maps.google.com/maps/place?cid=15889947727348850995","","","","",""
"กรีนกาแลคซี่","หน้าท.3, ตำบล รอบเวียง อำเภอเมืองเชียงราย เชียงราย 57000","0648740146","ร้านขายกัญชาในเทศบาลนครเชียงราย","https://lin.ee/Iu5IMa4","5.0","6",""," วันพุธ 9:00–22:00, วันพฤหัสบดี 9:00–22:00, วันศุกร์ 9:00–22:00, วันเสาร์ 9:00–22:00, วันอาทิตย์<div>(วันคล้ายวันสวรรคตพระบาทสมเด็จพระบรมชนกาธิเบศร มหาภูมิพลอดุลยเดชมหาราช บรมนาถบพิตร)</div> 9:00–22:00<div><span>เวลาทำการอาจแตกต่างกันไป</span></div>, วันจันทร์<div>(วันคล้ายวันสวรรคตพระบาทสมเด็จพระบรมชนกาธิเบศร มหาภูมิพลอดุลยเดชมหาราช บรมนาถบพิตร (วันหยุดชดเชย))</div> 9:00–22:00<div><span>เวลาทำการอาจแตกต่างกันไป</span></div>, วันอังคาร 9:00–22:00,","","Yes","No","No","No","No","ร้านสวยเจ้าของร้านเป็นกันเองใจดีราคาถูกแต่ของโคดดี🤑💚","ได้รับ 5.0 จาก 5 ดาว,","บรรยากาศเหมาะขนาดแอ่ 💨🌿💚💚","ได้รับ 5.0 จาก 5 ดาว,","เป็นกันเองครับ ราคาถูก","ได้รับ 5.0 จาก 5 ดาว,","https://lh5.googleusercontent.com/p/","1587091619447523108","19.895246999999998","99.83941779999999","http://maps.google.com/maps/place?cid=1587091619447523108","","","","",""
"ร้านกัญชา Zenleafshop","68/3 ถนน สันโค้งน้อย ซอย 9 ตำบล รอบเวียง อำเภอเมืองเชียงราย เชียงราย 57000","0996133469","ร้านขายกัญชาในเทศบาลนครเชียงราย","","5.0","1",""," วันพุธ 8:00–23:30, วันพฤหัสบดี 8:00–23:30, วันศุกร์ 8:00–23:00, วันเสาร์ 8:00–23:30, วันอาทิตย์<div>(วันคล้ายวันสวรรคตพระบาทสมเด็จพระบรมชนกาธิเบศร มหาภูมิพลอดุลยเดชมหาราช บรมนาถบพิตร)</div> 8:00–0:00<div><span>เวลาทำการอาจแตกต่างกันไป</span></div>, วันจันทร์<div>(วันคล้ายวันสวรรคตพระบาทสมเด็จพระบรมชนกาธิเบศร มหาภูมิพลอดุลยเดชมหาราช บรมนาถบพิตร (วันหยุดชดเชย))</div> 8:00–23:30<div><span>เวลาทำการอาจแตกต่างกันไป</span></div>, วันอังคาร 8:00–23:30,","","Yes","No","No","No","No","","","","","","","https://lh5.googleusercontent.com/p/AF1QipOyJXawAVUpFKgHPVKm_50unFc3a5fHjyXfx0dK","3970690063509730647","19.8999542","99.82050439999999","http://maps.google.com/maps/place?cid=3970690063509730647","","","","",""
"2Morrow Fresh Weed Store (Cannabis Shop)","เวียง 869/81 ถนน พิสิษฐสงวน (หน้าโรงแรมวังคำ อำเภอเมืองเชียงราย เชียงราย 57000","0910694266","ร้านขายกัญชาในเทศบาลนครเชียงราย","https://linktr.ee/0910694266_1","5.0","135",""," วันพุธ ปิดทำการ, วันพฤหัสบดี 15:00–0:00, วันศุกร์ 15:00–0:00, วันเสาร์ 15:00–0:00, วันอาทิตย์<div>(วันคล้ายวันสวรรคตพระบาทสมเด็จพระบรมชนกาธิเบศร มหาภูมิพลอดุลยเดชมหาราช บรมนาถบพิตร)</div> 15:00–0:00<div><span>เวลาทำการอาจแตกต่างกันไป</span></div>, วันจันทร์<div>(วันคล้ายวันสวรรคตพระบาทสมเด็จพระบรมชนกาธิเบศร มหาภูมิพลอดุลยเดชมหาราช บรมนาถบพิตร (วันหยุดชดเชย))</div> 15:00–0:00<div><span>เวลาทำการอาจแตกต่างกันไป</span></div>, วันอังคาร 15:00–0:00,","","Yes","No","No","No","No","บรรยากาศดีค่ะ มีให้เลือกหลายสายพันธุ์ ราคาถูกมากเทียบกับคุณภาพ","ได้รับ 5.0 จาก 5 ดาว,","ร้านน่านั่ง เจ้าของเป็นกันเอง บริการดีมากครับ","ได้รับ 5.0 จาก 5 ดาว,","Goog มากๆ 東西好 ของดีจริง มาไกลแต่คุ้มมาก จะมาใหม่นะ🧡🧡🧡","ได้รับ 5.0 จาก 5 ดาว,","https://lh5.googleusercontent.com/p/","2504485666530828377","19.9058612","99.8320597","http://maps.google.com/maps/place?cid=2504485666530828377","","","","",""
"Thai CBG","244 หมู่ 9 ตำบล ดงมะดะ อำเภอแม่ลาว เชียงราย 57250","0614492619","บริษัทเทคโนโลยีชีวภาพในตำบล ดงมะดะ","http://www.thaicbg.com/","4.9","8",""," วันพุธ เปิด 24 ชั่วโมง, วันพฤหัสบดี เปิด 24 ชั่วโมง, วันศุกร์ เปิด 24 ชั่วโมง, วันเสาร์ เปิด 24 ชั่วโมง, วันอาทิตย์<div>(วันคล้ายวันสวรรคตพระบาทสมเด็จพระบรมชนกาธิเบศร มหาภูมิพลอดุลยเดชมหาราช บรมนาถบพิตร)</div> ปิดทำการ, วันจันทร์<div>(วันคล้ายวันสวรรคตพระบาทสมเด็จพระบรมชนกาธิเบศร มหาภูมิพลอดุลยเดชมหาราช บรมนาถบพิตร (วันหยุดชดเชย))</div> เปิด 24 ชั่วโมง<div><span>เวลาทำการอาจแตกต่างกันไป</span></div>, วันอังคาร เปิด 24 ชั่วโมง,","","Yes","No","No","No","No","สถานที่สวย บรรยากาศดี และอารมณ์ดีค่ะ☺️","ได้รับ 5.0 จาก 5 ดาว,","ต้นกัญชงสวยๆเยอะเลยครับอนาคตจะเป็นโรงงานต้นแบบของเชียงรายเลย","ได้รับ 5.0 จาก 5 ดาว,","","","https://lh5.googleusercontent.com/p/AF1QipPgm-iNNTXerOOXcwZdREZAzy8EK0TYAT0yZ9ZI","3004260399726009545","19.716839500000003","99.67272559999999","http://maps.google.com/maps/place?cid=3004260399726009545","","","","",""
"GoGreen by Kanya - Chiang Rai","เวียง ตำบลเวียง อำเภอเมืองเชียงราย เชียงราย 57000","","บาร์","https://gogreenbykanya.com/","5.0","32",""," วันพุธ 16:00–1:00, วันพฤหัสบดี 16:00–1:00, วันศุกร์ 16:00–1:00, วันเสาร์ 16:00–1:00, วันอาทิตย์<div>(วันคล้ายวันสวรรคตพระบาทสมเด็จพระบรมชนกาธิเบศร มหาภูมิพลอดุลยเดชมหาราช บรมนาถบพิตร)</div> 16:00–1:00<div><span>เวลาทำการอาจแตกต่างกันไป</span></div>, วันจันทร์<div>(วันคล้ายวันสวรรคตพระบาทสมเด็จพระบรมชนกาธิเบศร มหาภูมิพลอดุลยเดชมหาราช บรมนาถบพิตร (วันหยุดชดเชย))</div> 16:00–1:00<div><span>เวลาทำการอาจแตกต่างกันไป</span></div>, วันอังคาร 16:00–1:00,","","Yes","No","No","No","No","ร้านสะอาด มีสายพันธ์หลากหลาย ทั้ง ซาติว่า อินดิก้า ไฮบริดหลากหลายราคาให้ลอง 😍","ได้รับ 5.0 จาก 5 ดาว,","ร้านสะอาด ดูแลบริการดีระดับ 5 ดาวสินค้ามีคุณภาพ หลากหลายราคา","ได้รับ 5.0 จาก 5 ดาว,","ของเขาดีจริงๆ 👍 Good quality and staff very nice 🎡","ได้รับ 5.0 จาก 5 ดาว,","https://lh5.googleusercontent.com/p/","17633025676572594060","19.9064795","99.83139919999999","http://maps.google.com/maps/place?cid=17633025676572594060","","","","",""
"Erawan grower Cannabis(กัญชา大麻)Shop","888 เวียง ตำบล เวียง อำเภอ เชียงแสน เชียงราย 57150","0855232583","ร้านขายกัญชาในตำบล เวียง","","5.0","1",""," วันพุธ 9:00–19:00, วันพฤหัสบดี 9:00–19:00, วันศุกร์ 9:00–19:00, วันเสาร์ 9:00–19:00, วันอาทิตย์<div>(วันคล้ายวันสวรรคตพระบาทสมเด็จพระบรมชนกาธิเบศร มหาภูมิพลอดุลยเดชมหาราช บรมนาถบพิตร)</div> 9:00–19:00<div><span>เวลาทำการอาจแตกต่างกันไป</span></div>, วันจันทร์<div>(วันคล้ายวันสวรรคตพระบาทสมเด็จพระบรมชนกาธิเบศร มหาภูมิพลอดุลยเดชมหาราช บรมนาถบพิตร (วันหยุดชดเชย))</div> 9:00–19:00<div><span>เวลาทำการอาจแตกต่างกันไป</span></div>, วันอังคาร 9:00–19:00,","","Yes","No","No","No","No","","","","","","","https://lh5.googleusercontent.com/p/AF1QipO2Mt3Outro9RO0k8oxsvQJLgRFplg_74Zw0jIq","1600804253605799897","20.289723199999997","100.0884945","http://maps.google.com/maps/place?cid=1600804253605799897","","","","",""
"ร้านกัญชา Heaven Cannabis แม่สาย","232/1 แม่สาย อำเภอแม่สาย เชียงราย 57310","0989208754","ร้านขายกัญชาในตำบล เวียงพางคำ","","5.0","8",""," วันพุธ 13:00–1:00, วันพฤหัสบดี 13:00–1:00, วันศุกร์ 13:00–1:00, วันเสาร์ 13:00–1:00, วันอาทิตย์<div>(วันคล้ายวันสวรรคตพระบาทสมเด็จพระบรมชนกาธิเบศร มหาภูมิพลอดุลยเดชมหาราช บรมนาถบพิตร)</div> 13:00–1:00<div><span>เวลาทำการอาจแตกต่างกันไป</span></div>, วันจันทร์<div>(วันคล้ายวันสวรรคตพระบาทสมเด็จพระบรมชนกาธิเบศร มหาภูมิพลอดุลยเดชมหาราช บรมนาถบพิตร (วันหยุดชดเชย))</div> 13:00–1:00<div><span>เวลาทำการอาจแตกต่างกันไป</span></div>, วันอังคาร 13:00–1:00,","","Yes","No","No","No","No","สถานที่ดีมากๆ ภายในร้านสะอาด ที่สำคัญอุปกรณ์เยอะมากกกกกกกกก","ได้รับ 5.0 จาก 5 ดาว,","ร้านสะอาด ไปแบบสบายๆ มีอะไรๆให้เลือกเยอะดี ไม่จำเจ","ได้รับ 5.0 จาก 5 ดาว,","เนื้อเมาบ้องสะอาดมาก","ได้รับ 5.0 จาก 5 ดาว,","https://lh5.googleusercontent.com/p/","15329027500993742590","20.4274545","99.8860334","http://maps.google.com/maps/place?cid=15329027500993742590","","","","",""
"Growertiger café (เชียงราย)","9 2 Chiang Rai ตำบล รอบเวียง เมือง เชียงราย 57000","0972269658","ร้านขายกัญชาในเทศบาลนครเชียงราย","https://www.facebook.com/profile.php?id=100086494392158&mibextid=ZbWKwL","5.0","7",""," วันพุธ 12:00–23:00, วันพฤหัสบดี 12:00–23:00, วันศุกร์ 12:00–23:00, วันเสาร์ 12:00–23:00, วันอาทิตย์<div>(วันคล้ายวันสวรรคตพระบาทสมเด็จพระบรมชนกาธิเบศร มหาภูมิพลอดุลยเดชมหาราช บรมนาถบพิตร)</div> 12:00–23:00<div><span>เวลาทำการอาจแตกต่างกันไป</span></div>, วันจันทร์<div>(วันคล้ายวันสวรรคตพระบาทสมเด็จพระบรมชนกาธิเบศร มหาภูมิพลอดุลยเดชมหาราช บรมนาถบพิตร (วันหยุดชดเชย))</div> 12:00–23:00<div><span>เวลาทำการอาจแตกต่างกันไป</span></div>, วันอังคาร 12:00–23:00,","","Yes","No","No","No","No","บริการดีคับคุยก็ดีคับดอกเมาๆทั้งนั้นงบน้อยก็เมาได้คับผม","ได้รับ 5.0 จาก 5 ดาว,","อยากเมาเยิ้ม เคลิ้มไปตามเพลง แล้วเจอกันฮะ","ได้รับ 5.0 จาก 5 ดาว,","","","https://lh5.googleusercontent.com/p/AF1QipMWDeYOMC3i2XFbJ01B6DzKBVM5Xaench-zB9iv","4893092118674205262","19.9008112","99.83486049999999","http://maps.google.com/maps/place?cid=4893092118674205262","","https://www.facebook.com/people/Growertiger-cafe/100086494392158/","","",""
"ร้านขายกัญชาแม่สาย Bluesman Cannabis","195 บ้านทุ่งเกลี้ยง ตำบล ศรีเมืองชุม อำเภอแม่สาย เชียงราย 57130","0877278688","ร้านค้าในตำบล ศรีเมืองชุม","https://www.facebook.com/BluesmanGunChaThai?mibextid=ZbWKwL","5.0","3",""," วันพุธ 8:00–21:00, วันพฤหัสบดี 8:00–21:00, วันศุกร์ 8:00–21:00, วันเสาร์ 9:00–21:00, วันอาทิตย์<div>(วันคล้ายวันสวรรคตพระบาทสมเด็จพระบรมชนกาธิเบศร มหาภูมิพลอดุลยเดชมหาราช บรมนาถบพิตร)</div> 9:00–21:00<div><span>เวลาทำการอาจแตกต่างกันไป</span></div>, วันจันทร์<div>(วันคล้ายวันสวรรคตพระบาทสมเด็จพระบรมชนกาธิเบศร มหาภูมิพลอดุลยเดชมหาราช บรมนาถบพิตร (วันหยุดชดเชย))</div> 8:00–21:00<div><span>เวลาทำการอาจแตกต่างกันไป</span></div>, วันอังคาร 8:00–21:00,","","Yes","No","No","No","No","บริการดีเต็ม100 เชิญร้านนี้เลยนะค่ะ❤️","ได้รับ 5.0 จาก 5 ดาว,","เชื่อถือได้ ถูกกฎหมาย สอบถามได้ทุกเรื่อง","ได้รับ 5.0 จาก 5 ดาว,","","","https://lh5.googleusercontent.com/p/","17755661572742937094","20.371641800000003","99.99848480000001","http://maps.google.com/maps/place?cid=17755661572742937094","","https://www.facebook.com/BluesmanGunChaThai","","",""
"Get high","135 5 ถ. พหลโยธิน แม่สาย อำเภอแม่สาย เชียงราย 57130","0924979899","ร้านขายกัญชาในแม่สาย","https://www.facebook.com/profile.php?id=61556355748474&mibextid=kFxxJD","4.7","3",""," วันพุธ 9:00–0:00, วันพฤหัสบดี 9:00–0:00, วันศุกร์ 9:00–0:00, วันเสาร์ 9:00–0:00, วันอาทิตย์<div>(วันคล้ายวันสวรรคตพระบาทสมเด็จพระบรมชนกาธิเบศร มหาภูมิพลอดุลยเดชมหาราช บรมนาถบพิตร)</div> 9:00–0:00<div><span>เวลาทำการอาจแตกต่างกันไป</span></div>, วันจันทร์<div>(วันคล้ายวันสวรรคตพระบาทสมเด็จพระบรมชนกาธิเบศร มหาภูมิพลอดุลยเดชมหาราช บรมนาถบพิตร (วันหยุดชดเชย))</div> 9:00–0:00<div><span>เวลาทำการอาจแตกต่างกันไป</span></div>, วันอังคาร 9:00–0:00,","","Yes","No","No","No","No","ของดี เมามาก อยากหาที่นั่งชิวๆแนะนำร้านนี้ค่ะ","ได้รับ 5.0 จาก 5 ดาว,","ของดีจริงครับโดนทีเดียวเหมือนไปอยู่เลบานอน","ได้รับ 5.0 จาก 5 ดาว,","","","https://lh5.googleusercontent.com/p/AF1QipOP1FsNiMrX-h5OXlTMkEpRf6jH5QXrCvEeGeJy","2411059829878492140","20.4421563","99.8816793","http://maps.google.com/maps/place?cid=2411059829878492140","","https://www.facebook.com/people/GET-HIGH/61556355748474/","","",""
"Now high","9 8 ตำบล เวียง อำเภอเวียงป่าเป้า เชียงราย 57170","0839818841","ร้านขายกัญชาในตำบล เวียง","https://linktr.ee/nowhighofficial","5.0","5",""," วันพุธ 13:30–18:00, วันพฤหัสบดี 13:30–18:00, วันศุกร์ 10:00–20:30, วันเสาร์ 10:00–20:00, วันอาทิตย์<div>(วันคล้ายวันสวรรคตพระบาทสมเด็จพระบรมชนกาธิเบศร มหาภูมิพลอดุลยเดชมหาราช บรมนาถบพิตร)</div> 10:00–17:00<div><span>เวลาทำการอาจแตกต่างกันไป</span></div>, วันจันทร์<div>(วันคล้ายวันสวรรคตพระบาทสมเด็จพระบรมชนกาธิเบศร มหาภูมิพลอดุลยเดชมหาราช บรมนาถบพิตร (วันหยุดชดเชย))</div> 13:30–18:00<div><span>เวลาทำการอาจแตกต่างกันไป</span></div>, วันอังคาร 13:30–18:00,","Nowhighร้านเราจัดจำหน่ายสมุนไพรควบคุมเพื่อการค้า (กัญชา)ที่ได้รับ ใบอนุญาตถูกต้องตามกฎหมายและให้คำปรึกษาเกี่ยวกัญชา ( ไม่ขายเพื่อสันทนาการ )* ตาชั่งดิจิตอลตราครุฑถูกต้องตามกฎหมาย *📍 ร้านอยู่ในซอยบ้านหนองยาว หมู่ 4 ติดกับร้านธนพิริยะ...แสดงเพิ่ม","Yes","No","No","No","No","ของดีราคาถูก ใครเดินทางเที่ยวเชียงราย-เชียงใหม่แนะนำร้านนี่","ได้รับ 5.0 จาก 5 ดาว,","อยากได้เนื้อคุณภาพเกินราคาต้องร้านนี้ขอรับ","ได้รับ 5.0 จาก 5 ดาว,","","","https://lh5.googleusercontent.com/p/","13184821559869715785","19.3430103","99.50974959999999","http://maps.google.com/maps/place?cid=13184821559869715785","","","","",""
