"Name","Address","Phone","Category","Website","Rating","Reviews","Price Range","Hours","Description","Merchant Verified","Business Closed","Dine-In","Takeout","Delivery","Review 1 Text","Review 1 Score","Review 2 Text","Review 2 Score","Review 3 Text","Review 3 Score","Image URL","Listing CID","Lat","Long","Listing URL","Email","Facebook","Twitter","Instagram","LinkedIn"
"Mahamao Cannabis I Delivery Only","หมู่บ้านทาวน์พลัสเอ็กซ์ประชาชื่น 48 ซ.งามวงศ์วาน 21 ท่าทราย อำเภอเมืองนนทบุรี เมือง นนทบุรี 11000","0953235109","ร้านขายกัญชาในเทศบาลนครนนทบุรี","https://lin.ee/yd9wi0G","5.0","4",""," วันพุธ 10:00–0:00, วันพฤหัสบดี 10:00–0:00, วันศุกร์ 10:00–0:00, วันเสาร์ 10:00–0:00, วันอาทิตย์<div>(วันคล้ายวันสวรรคตพระบาทสมเด็จพระบรมชนกาธิเบศร มหาภูมิพลอดุลยเดชมหาราช บรมนาถบพิตร)</div> 10:00–0:00<div><span>เวลาทำการอาจแตกต่างกันไป</span></div>, วันจันทร์<div>(วันคล้ายวันสวรรคตพระบาทสมเด็จพระบรมชนกาธิเบศร มหาภูมิพลอดุลยเดชมหาราช บรมนาถบพิตร (วันหยุดชดเชย))</div> 10:00–0:00<div><span>เวลาทำการอาจแตกต่างกันไป</span></div>, วันอังคาร 10:00–0:00,","Mahamao Grower(Home Grow)จำหน่ายช่อดอก เกรด Top Shelf**(🏡ไม่มีหน้าร้านนะคะซื้อกลับบ้านเท่านั้น takealways only!! )🥹 Support กันจะได้ไปเปิดหน้าร้านกันนะคะ🥹💰ราคาปลีก-ส่ง👾สายพันธุ์พิเศษ รับประกันคุณภาพปลูกเอามันส์ ปลูกเองขายเองฮะ🥹💚...แสดงเพิ่ม","Yes","No","No","No","No","","","","","","","https://lh5.googleusercontent.com/p/","14863373360835801688","13.8767579","100.53639869999999","http://maps.google.com/maps/place?cid=14863373360835801688","","","","",""
"TREEHC","23/13 ห้องB4 อำเภอเมืองนนทบุรี นนทบุรี 11000","0839838578","ร้านขายกัญชาในตำบล ท่าอิฐ","https://line.me/ti/p/QMkzVXvV4Y","5.0","2",""," วันพุธ 13:00–0:00, วันพฤหัสบดี 13:00–0:00, วันศุกร์ 13:00–0:00, วันเสาร์ 13:00–0:00, วันอาทิตย์<div>(วันคล้ายวันสวรรคตพระบาทสมเด็จพระบรมชนกาธิเบศร มหาภูมิพลอดุลยเดชมหาราช บรมนาถบพิตร)</div> 13:00–0:00<div><span>เวลาทำการอาจแตกต่างกันไป</span></div>, วันจันทร์<div>(วันคล้ายวันสวรรคตพระบาทสมเด็จพระบรมชนกาธิเบศร มหาภูมิพลอดุลยเดชมหาราช บรมนาถบพิตร (วันหยุดชดเชย))</div> 13:00–0:00<div><span>เวลาทำการอาจแตกต่างกันไป</span></div>, วันอังคาร 13:00–0:00,","","Yes","No","No","No","No","","","","","","","https://lh5.googleusercontent.com/p/AF1QipPiU2U0nuA8VMBETIH8fGk8L2gOcf27KRIRVXt6","16540572352894728390","13.894444799999999","100.45179549999999","http://maps.google.com/maps/place?cid=16540572352894728390","","","","",""
"Growerweed","ถ. ติวานนท์ ท่าทราย อำเภอเมืองนนทบุรี นนทบุรี 11000","0984609666","ร้านขายกัญชาในเทศบาลนครนนทบุรี","https://lin.ee/P53g3gw","5.0","3",""," วันพุธ 13:00–2:00, วันพฤหัสบดี 9:00–2:00, วันศุกร์ 13:00–2:00, วันเสาร์ 9:00–2:00, วันอาทิตย์<div>(วันคล้ายวันสวรรคตพระบาทสมเด็จพระบรมชนกาธิเบศร มหาภูมิพลอดุลยเดชมหาราช บรมนาถบพิตร)</div> 9:00–2:00<div><span>เวลาทำการอาจแตกต่างกันไป</span></div>, วันจันทร์<div>(วันคล้ายวันสวรรคตพระบาทสมเด็จพระบรมชนกาธิเบศร มหาภูมิพลอดุลยเดชมหาราช บรมนาถบพิตร (วันหยุดชดเชย))</div> 9:00–2:00<div><span>เวลาทำการอาจแตกต่างกันไป</span></div>, วันอังคาร 13:00–2:00,","","Yes","No","No","No","No","","","","","","","https://lh5.googleusercontent.com/p/","12758150381452593812","13.887143","100.5111478","http://maps.google.com/maps/place?cid=12758150381452593812","","","","",""
"Tobyhappyweeds","คอนโดเมืองทอง T5 15/9 บางพูด อำเภอปากเกร็ด นนทบุรี 11120","0885547491","","https://www.facebook.com/tobyhappyweeds?mibextid=LQQJ4d","5.0","2",""," วันพุธ 12:00–22:00, วันพฤหัสบดี 12:00–22:00, วันศุกร์ 12:00–22:00, วันเสาร์ 12:00–22:00, วันอาทิตย์<div>(วันคล้ายวันสวรรคตพระบาทสมเด็จพระบรมชนกาธิเบศร มหาภูมิพลอดุลยเดชมหาราช บรมนาถบพิตร)</div> 12:00–22:00<div><span>เวลาทำการอาจแตกต่างกันไป</span></div>, วันจันทร์<div>(วันคล้ายวันสวรรคตพระบาทสมเด็จพระบรมชนกาธิเบศร มหาภูมิพลอดุลยเดชมหาราช บรมนาถบพิตร (วันหยุดชดเชย))</div> 12:00–22:00<div><span>เวลาทำการอาจแตกต่างกันไป</span></div>, วันอังคาร 12:00–22:00,","","Yes","No","No","No","No","แต่มแจ๋ว🤟🏻🤟🏻🤟🏻🤟🏻","ได้รับ 5.0 จาก 5 ดาว,","","","","","https://lh5.googleusercontent.com/p/AF1QipNivmIG0FnqGAfmf-C3kZ2l3ycoBRYSrhdzo-uw","9279180638135602522","13.9156918","100.55594239999999","http://maps.google.com/maps/place?cid=9279180638135602522","","https://www.facebook.com/tobyhappyweeds?mibextid=LQQJ4d&_rdr","","",""
"ร้านกัญชา เลิฟกัญ","3 2 ตำบล คลองข่อย อำเภอปากเกร็ด นนทบุรี 11120","0943978172","","","","",""," วันพุธ 10:00–2:00, วันพฤหัสบดี 10:00–2:00, วันศุกร์ 10:00–2:00, วันเสาร์ 10:00–2:00, วันอาทิตย์<div>(วันคล้ายวันสวรรคตพระบาทสมเด็จพระบรมชนกาธิเบศร มหาภูมิพลอดุลยเดชมหาราช บรมนาถบพิตร)</div> 10:00–2:00<div><span>เวลาทำการอาจแตกต่างกันไป</span></div>, วันจันทร์<div>(วันคล้ายวันสวรรคตพระบาทสมเด็จพระบรมชนกาธิเบศร มหาภูมิพลอดุลยเดชมหาราช บรมนาถบพิตร (วันหยุดชดเชย))</div> 10:00–2:00<div><span>เวลาทำการอาจแตกต่างกันไป</span></div>, วันอังคาร 10:00–2:00,","","Yes","No","No","No","No","","","","","","","https://lh5.googleusercontent.com/p/","14232435474500135666","13.9522929","100.4726307","http://maps.google.com/maps/place?cid=14232435474500135666","","","","",""
"Friendly cannabis weed","N12 อำเภอบางกรวย นนทบุรี 11130","0811289192","ร้านขายกัญชาในตำบล บางสีทอง","https://web.facebook.com/profile.php?id=61551222424962&locale=th_TH","5.0","211",""," วันพุธ 9:00–0:00, วันพฤหัสบดี 9:00–0:00, วันศุกร์ 9:00–0:00, วันเสาร์ 9:00–0:00, วันอาทิตย์<div>(วันคล้ายวันสวรรคตพระบาทสมเด็จพระบรมชนกาธิเบศร มหาภูมิพลอดุลยเดชมหาราช บรมนาถบพิตร)</div> 9:00–0:00<div><span>เวลาทำการอาจแตกต่างกันไป</span></div>, วันจันทร์<div>(วันคล้ายวันสวรรคตพระบาทสมเด็จพระบรมชนกาธิเบศร มหาภูมิพลอดุลยเดชมหาราช บรมนาถบพิตร (วันหยุดชดเชย))</div> 9:00–0:00<div><span>เวลาทำการอาจแตกต่างกันไป</span></div>, วันอังคาร 12:00–0:00,","","Yes","No","No","No","No","ซื้อร้านนี้ทุกรอบบริการดี น้องเป็นที่รักมากครับคนขายเฟรินี่้สุดๆ","ได้รับ 5.0 จาก 5 ดาว,","ราคาไม่แรงเจ้าของใจดี สินค้าคุณภาพ แนะนำคับ","ได้รับ 5.0 จาก 5 ดาว,","เนื้อหอมดีครับ บรรยากาศดีครับ","ได้รับ 5.0 จาก 5 ดาว,","https://lh5.googleusercontent.com/p/AF1QipOBTrs1qQw2Nc0OtbZjTgQkDbTPd8iHeH7itO3G","11908549904515234302","13.813833400000002","100.4800042","http://maps.google.com/maps/place?cid=11908549904515234302","","https://www.facebook.com/people/Friendly-Cafe/61551222424962/","","",""
"Cannabis delivery nonthaburi","43/25 อำเภอปากเกร็ด นนทบุรี 11120","0802063952","","https://lin.ee/2YRgi9m","","",""," วันพุธ 10:00–0:00, วันพฤหัสบดี 10:00–0:00, วันศุกร์ 10:00–0:00, วันเสาร์ 10:00–0:00, วันอาทิตย์<div>(วันคล้ายวันสวรรคตพระบาทสมเด็จพระบรมชนกาธิเบศร มหาภูมิพลอดุลยเดชมหาราช บรมนาถบพิตร)</div> 10:00–0:00<div><span>เวลาทำการอาจแตกต่างกันไป</span></div>, วันจันทร์<div>(วันคล้ายวันสวรรคตพระบาทสมเด็จพระบรมชนกาธิเบศร มหาภูมิพลอดุลยเดชมหาราช บรมนาถบพิตร (วันหยุดชดเชย))</div> 10:00–0:00<div><span>เวลาทำการอาจแตกต่างกันไป</span></div>, วันอังคาร 10:00–0:00,","","Yes","No","No","No","No","","","","","","","https://lh5.googleusercontent.com/p/","17439054520792147711","13.938578399999999","100.51787709999999","http://maps.google.com/maps/place?cid=17439054520792147711","","","","",""
"Bud Candy House","56 60 Moo7, บางกระสอ อำเภอเมืองนนทบุรี นนทบุรี 11000","0859990431","ร้านขายกัญชาในเทศบาลนครนนทบุรี","http://facebook.com/Budcandyhouse","5.0","178",""," วันพุธ 16:00–2:00, วันพฤหัสบดี 16:00–2:00, วันศุกร์ 16:00–2:00, วันเสาร์ 16:00–2:00, วันอาทิตย์<div>(วันคล้ายวันสวรรคตพระบาทสมเด็จพระบรมชนกาธิเบศร มหาภูมิพลอดุลยเดชมหาราช บรมนาถบพิตร)</div> 16:00–2:00<div><span>เวลาทำการอาจแตกต่างกันไป</span></div>, วันจันทร์<div>(วันคล้ายวันสวรรคตพระบาทสมเด็จพระบรมชนกาธิเบศร มหาภูมิพลอดุลยเดชมหาราช บรมนาถบพิตร (วันหยุดชดเชย))</div> 16:00–2:00<div><span>เวลาทำการอาจแตกต่างกันไป</span></div>, วันอังคาร 16:00–2:00,","","Yes","No","No","No","No","เจ้าของร้านแนะนำดี สินค้าคุณภาพเกินราคาครับ :-)","ได้รับ 5.0 จาก 5 ดาว,","แฟนชอบมากมาซื้อทุกวัน เมาจนแม่ด่าก็ยังไม่เลิกซื้อเลยค่ะ อิอิ","ได้รับ 5.0 จาก 5 ดาว,","โครตเจ๋ง อย่างเมา ของดี ราคาถูก เปิด 16.00-2.00 น เลิกงานปึ้ปเติมชิวๆๆ","ได้รับ 5.0 จาก 5 ดาว,","https://lh5.googleusercontent.com/p/AF1QipPoDEI1sngJvTT_HiT2oONTxle2l3LuEbvIPA5R","8793883541494173125","13.8637889","100.49275809999999","http://maps.google.com/maps/place?cid=8793883541494173125","","https://www.facebook.com/Budcandyhouse","","",""
"The Spliff Cannabis Club (เดอะ สพริฟ แคนนาบิส คลับ)","92 41 ตำบล ไทรม้า อำเภอเมืองนนทบุรี นนทบุรี 11000","0826344277","ร้านขายกัญชาในตำบล ไทรม้า","http://www.facebook.com/dirtypunk85","5.0","3",""," วันพุธ 10:00–0:00, วันพฤหัสบดี 10:00–0:00, วันศุกร์ 10:00–2:00, วันเสาร์ 10:00–2:00, วันอาทิตย์<div>(วันคล้ายวันสวรรคตพระบาทสมเด็จพระบรมชนกาธิเบศร มหาภูมิพลอดุลยเดชมหาราช บรมนาถบพิตร)</div> 10:00–0:00<div><span>เวลาทำการอาจแตกต่างกันไป</span></div>, วันจันทร์<div>(วันคล้ายวันสวรรคตพระบาทสมเด็จพระบรมชนกาธิเบศร มหาภูมิพลอดุลยเดชมหาราช บรมนาถบพิตร (วันหยุดชดเชย))</div> 10:00–0:00<div><span>เวลาทำการอาจแตกต่างกันไป</span></div>, วันอังคาร 10:00–0:00,","The Spliff Cannabis Clubเดอะ สพริฟ แคนนาบิส คลับจำหน่ายอุปกรณ์ปลูกสมุนไพร สมุนไพร ดอกไม้ กิ่งชำ สายพันธุ์ค่ายดัง ออแกนิค 100%ใบอนุญาตครบ มีทั้งปลีกและส่ง ยินดีให้คำปรึกษาด้านการปลูก และ การขอใบอนุญาตFB : Suwapong ChuvichianLine : the_spliffTel...แสดงเพิ่ม","Yes","No","No","No","No","","","","","","","https://lh5.googleusercontent.com/p/","17150620041399930852","","","http://maps.google.com/maps/place?cid=17150620041399930852","","https://www.facebook.com/images/fb_icon_325x325.png","","",""
"THEZONEWEED เดอะโซนวีด ร้านกัญชาคุณภาพ","22/6 หมู่3 อาคารตึก 3 ชั้น ตำบล วัดชลอ อำเภอบางกรวย นนทบุรี 11130","0802819737","ร้านขายกัญชาในตำบล วัดชลอ","https://line.me/ti/p/Ty3SCMRMSj","5.0","88",""," วันพุธ 8:00–1:00, วันพฤหัสบดี 8:00–1:00, วันศุกร์ 8:00–1:00, วันเสาร์ 8:00–1:00, วันอาทิตย์<div>(วันคล้ายวันสวรรคตพระบาทสมเด็จพระบรมชนกาธิเบศร มหาภูมิพลอดุลยเดชมหาราช บรมนาถบพิตร)</div> 8:00–1:00<div><span>เวลาทำการอาจแตกต่างกันไป</span></div>, วันจันทร์<div>(วันคล้ายวันสวรรคตพระบาทสมเด็จพระบรมชนกาธิเบศร มหาภูมิพลอดุลยเดชมหาราช บรมนาถบพิตร (วันหยุดชดเชย))</div> 8:00–1:00<div><span>เวลาทำการอาจแตกต่างกันไป</span></div>, วันอังคาร 8:00–1:00,","","Yes","No","No","No","No","ราคาถูก คนขายหล่อ บริการดีมากคะ คุณภาพดีด้วยคะ","ได้รับ 5.0 จาก 5 ดาว,","ของดีแน่นอนครับแถมมีโปรโมชั่น บ่อย ทุกวันที่1 ทุกๆอย่างในร้านลด20% 🤩","ได้รับ 5.0 จาก 5 ดาว,","ราคาย่อมเยา เปิดแต่เช้าปิดดึก อยู่หัวโค้ง สังเกตง่ายครับ","ได้รับ 5.0 จาก 5 ดาว,","https://lh5.googleusercontent.com/p/AF1QipPkYbRXwvKgMHmr1ONqOKtegTmmhWqec0btkQIF","17684554449169189585","13.8102363","100.4669562","http://maps.google.com/maps/place?cid=17684554449169189585","","","","",""
"ร้านกัญชา PLAN B แพลน บี","098 741-3611 ซอย ท่าอิฐ ตำบล บางรักน้อย อำเภอไทรน้อย นนทบุรี 11000","0987413611","ร้านขายกัญชาในตำบล บางรักน้อย","https://line.me/ti/p/mOb22sLfM9","5.0","34",""," วันพุธ 12:00–0:00, วันพฤหัสบดี 12:00–0:00, วันศุกร์ 12:00–0:00, วันเสาร์ 12:00–0:00, วันอาทิตย์<div>(วันคล้ายวันสวรรคตพระบาทสมเด็จพระบรมชนกาธิเบศร มหาภูมิพลอดุลยเดชมหาราช บรมนาถบพิตร)</div> 12:00–0:00<div><span>เวลาทำการอาจแตกต่างกันไป</span></div>, วันจันทร์<div>(วันคล้ายวันสวรรคตพระบาทสมเด็จพระบรมชนกาธิเบศร มหาภูมิพลอดุลยเดชมหาราช บรมนาถบพิตร (วันหยุดชดเชย))</div> 12:00–0:00<div><span>เวลาทำการอาจแตกต่างกันไป</span></div>, วันอังคาร 12:00–0:00,","","Yes","No","No","No","No","เจ้าของร้านบริการดีเป็นกันเองราคาย่อมเยาเมามากๆ","ได้รับ 5.0 จาก 5 ดาว,","ราคาถูก เป็นกันเอง คนขายใจดีครับ","ได้รับ 5.0 จาก 5 ดาว,","ของดีครับอ้าย เมาตาแตก","ได้รับ 5.0 จาก 5 ดาว,","https://lh5.googleusercontent.com/p/","17432772669329541743","13.877065000000002","100.4593495","http://maps.google.com/maps/place?cid=17432772669329541743","","","","",""
"ท่อมสปีด 1","563 Soi 5, ท่าทราย เมือง นนทบุรี 11000","0923288294","ร้านขายกัญชาในเทศบาลนครนนทบุรี","https://www.facebook.com/profile.php?id=61557383933805&mibextid=LQQJ4d","5.0","3",""," วันพุธ ปิดทำการ, วันพฤหัสบดี 9:00–22:00, วันศุกร์ 9:00–22:00, วันเสาร์ 9:00–22:00, วันอาทิตย์<div>(วันคล้ายวันสวรรคตพระบาทสมเด็จพระบรมชนกาธิเบศร มหาภูมิพลอดุลยเดชมหาราช บรมนาถบพิตร)</div> 9:00–22:00<div><span>เวลาทำการอาจแตกต่างกันไป</span></div>, วันจันทร์<div>(วันคล้ายวันสวรรคตพระบาทสมเด็จพระบรมชนกาธิเบศร มหาภูมิพลอดุลยเดชมหาราช บรมนาถบพิตร (วันหยุดชดเชย))</div> 9:00–22:00<div><span>เวลาทำการอาจแตกต่างกันไป</span></div>, วันอังคาร 9:00–22:00,","","Yes","No","No","No","No","","","","","","","https://lh5.googleusercontent.com/p/AF1QipOrAw3Un6fvS3vPWfbw6ASl90GY1vxkuRXiMFE7","15033690909587488973","13.8821055","100.53431359999999","http://maps.google.com/maps/place?cid=15033690909587488973","","https://www.facebook.com/people/%E0%B8%AD%E0%B8%B1%E0%B8%A1%E0%B8%9E%E0%B8%A7%E0%B8%B2%E0%B8%9E%E0%B8%B2%E0%B9%80%E0%B8%A1%E0%B8%B2-420/61557383933805/","","",""
"BRSTONER","14 ตลาดนกฮูก 87 เลี่ยงเมืองนนท์ บางกระสอ อำเภอเมืองนนทบุรี นนทบุรี 11000","0909907436","ร้านขายกัญชาในเทศบาลนครนนทบุรี","https://www.facebook.com/profile.php?id=100093461330037&mibextid=ZbWKwL","5.0","2",""," วันพุธ 12:00–0:00, วันพฤหัสบดี 12:00–0:00, วันศุกร์ 12:00–0:00, วันเสาร์ 12:00–0:00, วันอาทิตย์<div>(วันคล้ายวันสวรรคตพระบาทสมเด็จพระบรมชนกาธิเบศร มหาภูมิพลอดุลยเดชมหาราช บรมนาถบพิตร)</div> 12:00–0:00<div><span>เวลาทำการอาจแตกต่างกันไป</span></div>, วันจันทร์<div>(วันคล้ายวันสวรรคตพระบาทสมเด็จพระบรมชนกาธิเบศร มหาภูมิพลอดุลยเดชมหาราช บรมนาถบพิตร (วันหยุดชดเชย))</div> 12:00–0:00<div><span>เวลาทำการอาจแตกต่างกันไป</span></div>, วันอังคาร 12:00–0:00,","","Yes","No","No","No","No","เนื้อถึงมากครับของดีเมืองนนท์เลย","ได้รับ 5.0 จาก 5 ดาว,","ของเค้าดีจริงคับจากผู้ใช้งาน🤙🏻👍🏻👍🏻","ได้รับ 5.0 จาก 5 ดาว,","","","https://lh5.googleusercontent.com/p/","15158777178868106879","13.868246899999999","100.49400539999999","http://maps.google.com/maps/place?cid=15158777178868106879","","https://www.facebook.com/profile.php?id=100093461330037&mibextid=ZbWKwL&_rdr","","",""
